{
  "run_config_spec_version": "0.1-draft",
  "run_config_id": "rcfg_tinyllama_alpha_demo",
  "name": "TinyLlama alpha demo",
  "description": "Known-good first-user alpha path: one public GGUF, one llama.cpp profile, no capability lane.",
  "created_at": "2026-03-24T00:00:00Z",
  "created_by": "infergrade",
  "tags": [
    "alpha",
    "demo",
    "llama.cpp",
    "tinyllama"
  ],
  "request": {
    "spec_version": "0.1-draft",
    "run": {
      "model": "TinyLlama/TinyLlama-1.1B-Chat-v1.0",
      "backend": "llama.cpp",
      "tier": "canary",
      "use_case": "general_assistant",
      "capability": "none",
      "deployment_profiles": [
        "interactive_chat_v1"
      ]
    },
    "artifacts": {
      "quantized_weights": {
        "uri": "hf://TheBloke/TinyLlama-1.1B-Chat-v1.0-GGUF/tinyllama-1.1b-chat-v1.0.Q4_K_M.gguf",
        "filename": "tinyllama-1.1b-chat-v1.0.Q4_K_M.gguf"
      }
    },
    "runtime": {
      "backend_image": "infergrade-llama-cpp:0.1.0-alpha",
      "artifact_cache_dir": "~/.cache/infergrade/artifacts"
    },
    "ontology_hints": {
      "family_name": "TinyLlama",
      "checkpoint_name": "TinyLlama-1.1B-Chat-v1.0",
      "training_stage": "instruction_tuned",
      "quantization_family": "k_quant",
      "quantization_scheme": "Q4_K_M",
      "weight_precision_bits": 4
    },
    "metadata": {
      "notes": "First-user alpha demo config intended to validate the minimal hosted flow."
    }
  }
}
