{
  "run_config_spec_version": "0.1-draft",
  "run_config_id": "rcfg_tinyllama_preview_demo",
  "name": "TinyLlama preview demo",
  "description": "Known-good setup path: one public GGUF, one llama.cpp profile, one short decision-suite deployment check.",
  "created_at": "2026-03-24T00:00:00Z",
  "created_by": "infergrade",
  "tags": [
    "preview",
    "demo",
    "llama.cpp",
    "tinyllama"
  ],
  "request": {
    "spec_version": "0.1-draft",
    "run": {
      "model": "TinyLlama/TinyLlama-1.1B-Chat-v1.0",
      "backend": "llama.cpp",
      "tier": "canary",
      "use_case": "general_assistant",
      "capability": "none",
      "capability_suite_ids": [
        "chat_instruction_following"
      ],
      "benchmark_group_ids": [
        "deployment_chat"
      ],
      "benchmark_check_ids": [
        "interactive_chat_v1"
      ],
      "deployment_profiles": [
        "interactive_chat_v1"
      ]
    },
    "artifacts": {
      "quantized_weights": {
        "uri": "hf://TheBloke/TinyLlama-1.1B-Chat-v1.0-GGUF/tinyllama-1.1b-chat-v1.0.Q4_K_M.gguf",
        "filename": "tinyllama-1.1b-chat-v1.0.Q4_K_M.gguf"
      }
    },
    "runtime": {
      "backend_image": "infergrade-llama-cpp:0.3.5",
      "artifact_cache_dir": "~/.cache/infergrade/artifacts"
    },
    "ontology_hints": {
      "family_name": "TinyLlama",
      "checkpoint_name": "TinyLlama-1.1B-Chat-v1.0",
      "training_stage": "instruction_tuned",
      "quantization_family": "k_quant",
      "quantization_scheme": "Q4_K_M",
      "weight_precision_bits": 4
    },
    "metadata": {
      "notes": "First-user demo config intended to validate pair -> run -> upload -> report -> compare with a short decision-suite deployment check."
    }
  }
}
